job_title,publish,company,city,description,link,website,date,search_title
Data Analyst / Scientist (m/w/d),vor 4 Tagen,eWolff GmbH,Bielefeld,"Finde Deine Rolle und verstärke unser Team Data Analytics als Data Analyst / Scientist (m/w/d) Data-Driven? * Science, BWL/VWL, MINT oder ähnliches studiert",https://www.stepstone.de/stellenangebote--Data-Analyst-Scientist-m-w-d-Bielefeld-eWolff-GmbH--8228787-inline.html,stepstone,2022-11-16,Data_Scientist
Data Scientist (m/w/d),vor 1 Woche,CONTACT Software GmbH,"Home-Office oder Bremen, Berlin, Paderborn, Duisburg, Köln, Frankfurt, Karlsruhe, Augsburg, München","CONTACT Software GmbH * Home-Office oder Bremen, Berlin, Paderborn, Duisburg, Köln, Frankfurt, Karlsruhe, Augsburg, München * Feste Anstellung * Home Office möglich,Vollzeit - CONTACT Software verbindet Menschen, Unternehmen und Systeme - Als führender Softwarehersteller für innovative Produktentstehungsprozesse und die digitale Transformation haben wir einen modularen Software-Baukasten auf Basis einer offenen Technologieplattform geschaffen, mit dem unsere weltweiten Kunden als internationale Marktführer ihre Produktdaten in agilen Prozessen und kollaborativen Projekten effizienter nutzen. Seit über 30 Jahren entwickeln und implementieren wir smarte Softwarelösungen, die moderne IT-Systeme mit dem Internet der Dinge (IoT) verbinden. Mehr als 350 kreative Köpfe an über zehn Standorten und ein internationales Partnernetzwerk arbeiten täglich daran, unsere Angebote und",https://www.stepstone.de/stellenangebote--Data-Scientist-m-w-d-Home-Office-oder-Bremen-Berlin-Paderborn-Duisburg-Koeln-Frankfurt-Karlsruhe-Augsburg-Muenchen-CONTACT-Software-GmbH--8869313-inline.html,stepstone,2022-11-16,Data_Scientist
Data Scientist / Analyst - Web (m/w/d),vor 2 Wochen,Neue Westfälische GmbH & Co. KG,Bielefeld,Wir suchen nach einem Data Analyst/Data Scientist (m/w/d) mit dem Fokus auf unsere Website.,https://www.stepstone.de/stellenangebote--Data-Scientist-Analyst-Web-m-w-d-Bielefeld-Neue-Westfaelische-GmbH-Co-KG--8866842-inline.html,stepstone,2022-11-16,Data_Scientist
Data Scientist (m/w/d),vor 2 Wochen,FERCHAU GmbH,Bielefeld,"Planung, Konzeption, Umsetzung und Wartung von Lösungen in den Bereichen Big Data und Data Science",https://www.stepstone.de/stellenangebote--Data-Scientist-m-w-d-Bielefeld-FERCHAU-GmbH--7838347-inline.html,stepstone,2022-11-16,Data_Scientist
Software Entwickler * IIoT Services,vor 3 Wochen,Weidmüller Gruppe,Paderborn,"Eigenverantwortliche Mitarbeit in einem agilen Softwareentwicklungsprozess und in enger Zusammenarbeit mit Frontend-Entwicklern *, UX-Designern *, und Applikations-Ingenieuren *",https://www.stepstone.de/stellenangebote--Software-Entwickler-IIoT-Services-Paderborn-Weidmueller-Gruppe--8078081-inline.html,stepstone,2022-11-16,Data_Scientist
(Senior) Key Expert* IIoT & Data Science,vor 1 Woche,HARTING Stiftung & Co. KG,Espelkamp in der Region Bielefeld,"(Senior) Key Expert* IIoT & Data Science - The Senior Key Expert for IIoT & Data Science will drive the topic of the industrial internet of things and related science to push advanced connectivity for IIoT applications and deliver the technologies to accomplish -driven business models. * Represent the topics of IIoT and science as a designated expert and contact person * Expert knowledge in most of the following scientific areas: cloud infrastructure, structures, understanding and application of artificial intelligence and algorithms, digital twin, digital services, common digital exchange formats, programming languages and frameworks * Technology enthusiasm, curiosity about IIoT and science as well as interest in adjacent tech",https://www.stepstone.de/stellenangebote--Senior-Key-Expert-IIoT-Data-Science-Espelkamp-in-der-Region-Bielefeld-HARTING-Stiftung-Co-KG--8837269-inline.html,stepstone,2022-11-16,Data_Scientist
Enterprise Data Architect (m/f/d),vor 1 Tag,Arvato Infoscore GmbH,"Oslo, Berlin, Baden-Baden, Verl","In this role you will work extensively with data and data analysis in a variety of tools and methods. We expect you to be truly interested in and love to work and wrangle with it. Ultimately, you will enhance our business intelligence solutions to help us make better decisions and become a more driven company. * You design the architecture of our modern platform that enables BI, Science and Machine Learning. * You formulate techniques for quality collection to ensure adequacy, accuracy and legitimacy of * You create, improve and maintain our architectures to create and distribute complex datasets. * You make sure is separated, secured and meeting local as well",https://www.stepstone.de/stellenangebote--Enterprise-Data-Architect-m-f-d-Oslo-Berlin-Baden-Baden-Verl-Arvato-Infoscore-GmbH--8871550-inline.html,stepstone,2022-11-16,Data_Scientist
Enterprise Data Architect (m/f/d),vor 2 Tagen,Arvato Infoscore GmbH,"Berlin, Verl, Baden-Baden","You design the architecture of our modern data platform that enables BI, Data Science and Machine Learning. * You formulate techniques for quality collection to ensure adequacy, accuracy and legitimacy of * You create, improve and maintain our architectures to create and distribute complex datasets. * You make sure is separated, secured and meeting local as well as international security and privacy standards such as GDPR and other. * You define objects and attributes, definitions, and RASIC matrix for creation, access, change, sources of truth. * You create and enforce policies for effective management. * You ensure digital databases and",https://www.stepstone.de/stellenangebote--Enterprise-Data-Architect-m-f-d-Berlin-Verl-Baden-Baden-Arvato-Infoscore-GmbH--8917739-inline.html,stepstone,2022-11-16,Data_Scientist
"(Junior) Consultant (w/m/d) IT Prozesse, Big Data und Compliance",vor 2 Tagen,KPMG AG Wirtschaftsprüfungsgesellschaft,"Leipzig, Bielefeld, Dresden, Bremen, Freiburg, Essen, Mainz, Karlsruhe, Dortmund, Regensburg","Als (Junior) Consultant (w/m/d) IT Prozesse, Big Data und Compliance prüfst Du die Systeme unserer Kunden und Kundinnen und bewertest deren IT gestützte Geschäftsprozesse. * Als (Junior) Consultant (w/m/d) für IT Prozesse, Big und Compliance prüfst Du die Einhaltung von Anforderungen im IT-Compliance- und IT Governance-Umfeld und berätst unsere Kund:innen bei der Umsetzung der Regularien. Internet of Things (IoT), Big SAP, Industrie 4.0, IT-Revision, IT Audit oder Robotics sind keine Fremdwörter für Dich.",https://www.stepstone.de/stellenangebote--Junior-Consultant-w-m-d-IT-Prozesse-Big-Data-und-Compliance-Leipzig-Bielefeld-Dresden-Bremen-Freiburg-Essen-Mainz-Karlsruhe-Dortmund-Regensburg-KPMG-AG-Wirtschaftspruefungsgesellschaft--8905503-inline.html,stepstone,2022-11-16,Data_Scientist
Lighting Modules Technology & Portfolio Engineer (m/f/d),vor 5 Tagen,HELLA Gruppe,Lippstadt,"HELLA Gruppe - Lighting Modules Technology & Portfolio Engineer (m/f/d) * Lippstadt * Feste Anstellung * Home Office möglich,Vollzeit - HELLA GmbH & Co. KGaA - HELLA is a listed, internationally positioned automotive supplier operating under the umbrella brand FORVIA. Within this de facto group, HELLA stands for high-performance lighting technology and automotive electronics. At the same time, the Company covers a broad service and product portfolio for the spare parts and workshop business as wellacturers of special-purpose vehicles with its Lifecycle Solutions business group. HELLA has around 36,000 employees at more than 125 locations worldwide and generated consolidated sales of € 6.3 billion in the fiscal year 2021/2022. As a Lighting Modules Technology & Portfolio Engineer in the Business Group Lighting you are the engineering pioneer for the future of lighting",https://www.stepstone.de/stellenangebote--Lighting-Modules-Technology-Portfolio-Engineer-m-f-d-Lippstadt-HELLA-Gruppe--8911467-inline.html,stepstone,2022-11-16,Data_Scientist
(Senior) Consultant Data Analytics – Public Sector und Energy Consulting (w/m/d),vor 1 Woche,PwC,"Bielefeld, Düsseldorf, Frankfurt a. M., Hannover, Köln","Dein Studium hast du erfolgreich abgeschlossen und bringst erste Berufserfahrung in den Bereichen Reporting, Controlling und Analytics mit.",https://www.stepstone.de/stellenangebote--Senior-Consultant-Data-Analytics-Public-Sector-und-Energy-Consulting-w-m-d-Bielefeld-Duesseldorf-Frankfurt-a-M-Hannover-Koeln-PwC--8488672-inline.html,stepstone,2022-11-16,Data_Scientist
(Senior) Data Engineer (m/f/d),vor 1 Woche,Arvato Infoscore GmbH,"Berlin, Baden-Baden, Verl","Our ambition is higher and now we have a great opportunity for a Data Engineer (m/f/d) to join our growing team. to create and manage BI and analytics solutions that turn data into knowledge using cutting-edge technology. In this role you will work extensively with data and data analysis in a variety of tools and methods. We expect you to be truly interested in data and love to work and wrangle with it. Ultimately, you will enhance our business intelligence solutions to help us make better decisions and become a more data driven company. * Semantic Power BI data modelling and dashboarding for requested initiatives. * Take lead in design and development of ETL solutions using Azure Data Factory, Databricks and other data tools. * Collaborate with international teams to integrate varieties of systems ultimately creating the 'Riverty data universe'.",https://www.stepstone.de/stellenangebote--Senior-Data-Engineer-m-f-d-Berlin-Baden-Baden-Verl-Arvato-Infoscore-GmbH--8891646-inline.html,stepstone,2022-11-16,Data_Scientist
Analyst Consultant (all genders) SAP SuccessFactors,vor 2 Wochen,adesso orange AG,"Dortmund, Oldenburg, Osnabrück,Paderborn,Potsdam,Reutlingen,Rostock,Saarbrücken Stralsund, Stuttgart","adesso orange AG * Dortmund, Oldenburg, Osnabrück,Paderborn,Potsdam,Reutlingen,Rostock,Saarbrücken Stralsund, Stuttgart * Feste Anstellung * Home Office möglich,Vollzeit - Wir sind adesso orange, das SAP Powerhouse der adesso Gruppe: eines der größten deutschen - IT-Dienstleistungsunternehmen mit beeindruckender Wachstumsperspektive. Als SAP Gold Partner treiben wir mit unseren mehr als 300 Expertinnen und Experten den digitalen Wandel in unterschiedlichsten Branchen in ganz Deutschland voran. Dafür suchen wir Teamplayer, die sich mit Kompetenz, Kreativität und Leidenschaft in unsere IT-Projekte einbringen. adesso orange macht Tempo – auch wenn es um die Weiterentwicklung unserer Mitarbeitenden geht. Denn schließlich wollen wir gemeinsam mit dir wachsen. Für unsere Ziele packen wir alle mit an - vom Werkstudenten bis zum Management.",https://www.stepstone.de/stellenangebote--Analyst-Consultant-all-genders-SAP-SuccessFactors-Dortmund-Oldenburg-Osnabrueck-Paderborn-Potsdam-Reutlingen-Rostock-Saarbruecken-Stralsund-Stuttgart-adesso-orange-AG--8164729-inline.html,stepstone,2022-11-16,Data_Scientist
Junior Data Engineer (m/w/d),vor 1 Woche,CTH Gesellschaft für Entscheidungs- und Informationssysteme mbH,Halle,"Zur Unterstützung unserer Bereiche Anwendungsberatung/-entwicklung und Systemanalyse/-entwicklung suchen wir Sie als motivierte(n), engagierte(n) Junior Engineer (m/w/d) * Realisierung von BI / Big Lösungen im Backend (Datenmodell, Struktur, ETL, Datenhaltung)",https://www.stepstone.de/stellenangebote--Junior-Data-Engineer-m-w-d-Halle-CTH-Gesellschaft-fuer-Entscheidungs-und-Informationssysteme-mbH--8829042-inline.html,stepstone,2022-11-16,Data_Scientist
Praktikant/Werkstudent Nachhaltigkeit Data Specialist (w/m/d),vor 2 Wochen,PwC,"Berlin, Bielefeld, Bremen, Duisburg, Düsseldorf, Erfurt, Essen, Frankfurt a. M., Hamburg, Hannover","PwC * Berlin, Bielefeld, Bremen, Duisburg, Düsseldorf, Erfurt, Essen, Frankfurt a. M., Hamburg, Hannover * Praktikum,Studentenjobs, Werkstudent * Teilzeit,Vollzeit - Du hast Talent. Wir sind ein internationales Netzwerk aus 284.000 Mitarbeiter:innen, die ihr Wissen, ihre Erfahrungen und ihre Ideen miteinander teilen. Du suchst einen herausfordernden, spannenden Job. Wir bieten dir als weltweit führende Wirtschaftsprüfungs- und Beratungsgesellschaft ein Maximum an Möglichkeiten für einen Karriereweg nach deinen Vorstellungen. Du möchtest Verantwortung für deine Ergebnisse übernehmen, Lösungen gemeinsam mit dem Kunden entwickeln, die digitale Transformation in Deutschland vorantreiben und einen Arbeitgeber mit passenden Werten. Unser Denken und Handeln orientiert sich an Grundsätzen, die von Vertrauen, Respekt, Weitsicht, Wertschätzung und Innovation geprägt sind.",https://www.stepstone.de/stellenangebote--Praktikant-Werkstudent-Nachhaltigkeit-Data-Specialist-w-m-d-Berlin-Bielefeld-Bremen-Duisburg-Duesseldorf-Erfurt-Essen-Frankfurt-a-M-Hamburg-Hannover-PwC--8752064-inline.html,stepstone,2022-11-16,Data_Scientist
Analyst Formular Consultant (all genders),vor 3 Wochen,adesso orange AG,"Dortmund, Hannover, Jena, Karlsruhe, Kiel, Köln, Leipzig, München, Nürnberg, Paderborn, Potsdam","adesso orange AG * Dortmund, Hannover, Jena, Karlsruhe, Kiel, Köln, Leipzig, München, Nürnberg, Paderborn, Potsdam * Feste Anstellung * Vollzeit - Die adesso orange AG ist Teil der adesso Group, ein börsennotiertes Beratungs- und IT-Dienstleistungsunternehmen mit rund 5.000 Mitarbeitenden. Die adesso orange AG ist im April 2021 aus einem Zusammenschluss der QUANTO AG mit der adesso Group entstanden. Als SAP® Gold-Partner bieten wie schnelle Verantwortungsübernahme und herausfordernde Aufgaben, wir arbeiten auf Augenhöhe und stärken uns gegenseitig. Wir lieben, was wir tun und entwickeln gemeinsam mit unseren Kunden zukunftsorientierte Lösungen. Unsere Leidenschaft sind technische und betriebswirtschaftliche Themen mit Schwerpunkt auf SAP® Lösungen und modernen Entwicklungstechnologien. Spätestens 2027 beendet SAP® den Support für sein Altsystem.",https://www.stepstone.de/stellenangebote--Analyst-Formular-Consultant-all-genders-Dortmund-Hannover-Jena-Karlsruhe-Kiel-Koeln-Leipzig-Muenchen-Nuernberg-Paderborn-Potsdam-adesso-orange-AG--7736288-inline.html,stepstone,2022-11-16,Data_Scientist
Data Scientist (w/m/d),vor 10 Stunden,Kienbaum Consultants International GmbH - Zentrale,bundesweit,Das Team “Data Science and Data Management” verantwortet den gesamten Datenverarbeitungsprozess von der Datenerhebung bis hin zur Erstellung von digitalen Produkten.,https://www.stepstone.de/stellenangebote--Data-Scientist-w-m-d-bundesweit-Kienbaum-Consultants-International-GmbH-Zentrale--8924553-inline.html,stepstone,2022-11-16,Data_Scientist
Junior Geo Data Scientist (m/w/d),vor 2 Tagen,Telefónica Germany GmbH & Co. OHG,bundesweit,"Als Junior Geo Data Scientist bist Du zentraler Teil des Business & Strategic Analytics Teams, in dem wir eine offene Atmosphäre pflegen und vor allem mit viel Motivation und Spaß bei der Sache sind! Als GEOoffice sind wir Teil des Digital & Competence Centers bei Telefónica Deutschland und unterstützen die Fachbereiche (beispielsweise Technology, B2B, B2C und B2P) durch geographische Analysen und Daten. * Gute Kenntnisse in SQL-Programmierung sowie einer Science Programmiersprache (bspw. Python)",https://www.stepstone.de/stellenangebote--Junior-Geo-Data-Scientist-m-w-d-bundesweit-Telefonica-Germany-GmbH-Co-OHG--8916684-inline.html,stepstone,2022-11-16,Data_Scientist
Data Architect (gn),vor 19 Stunden,SoftwareONE Deutschland GmbH,"Home-Office, Leipzig, Berlin, Hamburg","Unser Team ist ein Mix aus Data Architects, Data Scientists und Application Architects. Die rasante Entwicklung von neuen Technologien und Rechenkapazitäten bietet dabei ständig neue Möglichkeiten, die wir für unsere Kunden in den Bereichen Digital Advisory, Solution Architecture oder Analytics nutzen. Als Architect (gn) wirst du Teil unseres 10-köpfigen Advisory-Teams. Wir beraten Größen aus allen Branchen zu Lakes, Warehousing, BI & AI Analytics, Big eben alles rund um als Basis für valide Business Entscheidungen und bieten damit immer spannende neue Projektumfelder, ob Beratung, Proof-of-Concept oder MVP. * Definition und Kontrolle der Governance liegen in deinen Händen. * Deine",https://www.stepstone.de/stellenangebote--Data-Architect-gn-Home-Office-Leipzig-Berlin-Hamburg-SoftwareONE-Deutschland-GmbH--8450015-inline.html,stepstone,2022-11-16,Data_Scientist
Software Engineer – Data Science & Data Management w/m/d,vor 3 Wochen,Kienbaum Consultants International GmbH - Zentrale,bundesweit,"Dabei arbeitest Du in interdisziplinären Teams aus Data Scientists, Data Engineers, Anwendungsentwickler:innen, IT Operations und Produktmanager:innen. Software Engineer – Science & Management w/m/d - Das Team „ Science and Management“ verantwortet den gesamten Datenverarbeitungsprozess von der Datenerhebung bis hin zur Erstellung von digitalen Produkten.",https://www.stepstone.de/stellenangebote--Software-Engineer-Data-Science-Data-Management-w-m-d-bundesweit-Kienbaum-Consultants-International-GmbH-Zentrale--8738239-inline.html,stepstone,2022-11-16,Data_Scientist
"Elektriker, Elektroniker oder Mechatroniker (m/w/d) Gebäudetechnik DP DHL - Hannover",vor 1 Woche,Deutsche Post DHL Facility Management Deutschland GmbH,"Hannover, D-PLZ 30","Deutsche Post DHL Facility Management Deutschland GmbH * Hannover, D-PLZ 30 * Feste Anstellung * Vollzeit - Was wir bieten - CORPORATE REAL ESTATE – IMMOBILIENDIENSTLEISTUNGEN FÜR DIE LOGISTIK VON HEUTE UND MORGEN - Lust, die Zukunft der Logistik mitzugestalten - nicht irgendwo - sondern bei Deutsche Post DHL Group, dem weltweit führenden Logistikanbieter? Dann kommen Sie ins Team von Corporate Real Estate. 1.400 Expertinnen und Experten freuen sich auf Sie. Briefzentren, Paketzentren, Zustellstützpunkte, uvm. – kurzum – tausende Immobilien des flächendeckenden Brief- und Paketnetzes in Deutschland welche kontinuierlich unter Digitalisierungs- und Nachhaltigkeitsaspekten ausgebaut werden. * Ein sicherer Arbeitgeber und ein unbefristetes Arbeitsverhältnis – auch in Krisenzeiten * Modernste Arbeitsbedingungen - bei uns erhalten Sie Freiräume, die es Ihnen ermöglicht, Ih",https://www.stepstone.de/stellenangebote--Elektriker-Elektroniker-oder-Mechatroniker-m-w-d-Gebaeudetechnik-DP-DHL-Hannover-Hannover-D-PLZ-30-Deutsche-Post-DHL-Facility-Management-Deutschland-GmbH--8897151-inline.html,stepstone,2022-11-16,Data_Scientist
Senior Clinical Scientist (Translational Medicine Expert) (f/m/d),vor 1 Woche,CureVac SE,Rhein-Main-Gebiet,"Discuss plans and data with and integrate their advice to achieve and maintain excellence in the field * Provide analysis, interpretation and integration of immunomonitoring/ biomarker into regulatory documents/ study reports and publications * Managing projects involving clinical sample/ analyses conducted at contractors or academic collaborators",https://www.stepstone.de/stellenangebote--Senior-Clinical-Scientist-Translational-Medicine-Expert-f-m-d-Rhein-Main-Gebiet-CureVac-SE--8839241-inline.html,stepstone,2022-11-16,Data_Scientist
Fullstack Senior Software Engineer (m/w/d),vor 6 Tagen,IU Internationale Hochschule,deutschlandweit,"You develop new automation tools to extend our learning media databases in collaboration with our AI product owners, domain experts and key users - We are passionate, competitive, open to everything new - and we love",https://www.stepstone.de/stellenangebote--Fullstack-Senior-Software-Engineer-m-w-d-deutschlandweit-IU-Internationale-Hochschule--8860251-inline.html,stepstone,2022-11-16,Data_Scientist
DataOps Engineer (m/f/d),vor 1 Woche,Vaillant Group Business Services GmbH,"Remscheid, Home-Office","You contribute to the constant extension and improvement of the data hub infrastructure and work close with and engineers to understand their needs and requirements * You are part of a growing agile community creating the backbone for the digital future of Vaillant * As a member of a newly build team, you support the development and operation of a hub and corresponding interfaces and loads * You are responsible for the implementation, automation, operation and further development of processing pipeline and integrations * Furthermore, you design the integration architecture and infrastructure together with the architects and integrate it in the existing setup * You have been exposed to the",https://www.stepstone.de/stellenangebote--DataOps-Engineer-m-f-d-Remscheid-Home-Office-Vaillant-Group-Business-Services-GmbH--8841355-inline.html,stepstone,2022-11-16,Data_Scientist
Field Service Engineer (m/f/d),vor 5 Tagen,Bruker Nano GmbH,"bundesweit, Österreich","Bruker is enabling scientists to make breakthrough discoveries and develop new applications that improve the quality of human life. * Good computer literacy, including familiarity with system hardware and industry standard operating systems",https://www.stepstone.de/stellenangebote--Field-Service-Engineer-m-f-d-bundesweit-Oesterreich-Bruker-Nano-GmbH--8864694-inline.html,stepstone,2022-11-16,Data_Scientist
(Junior/Senior) Business Analyst (w/m/d),vor 2 Wochen,ALTER SOLUTIONS Deutschland GmbH,"Düsseldorf, Münster, München, Hamburg, Berlin, bundesweit ( Home-Office)","Jeder einzelne unserer über 60 Agile Consultants, DevOps Engineers, UI Designer, Java Developer, Cloud Architekten, Test Automatisierer, IoT Experten, Ethical Hacker, Penetration Tester und ist für uns der wichtigste und wertvollste Mitarbeiter.",https://www.stepstone.de/stellenangebote--Junior-Senior-Business-Analyst-w-m-d-Duesseldorf-Muenster-Muenchen-Hamburg-Berlin-bundesweit-Home-Office-ALTER-SOLUTIONS-Deutschland-GmbH--7821375-inline.html,stepstone,2022-11-16,Data_Scientist
Senior Product Manager / Kundenkonto (all genders) - full remote möglich,vor 2 Tagen,Chrono24 GmbH,"Karlsruhe, Home-Office","Mit einem interdisziplinären Scrum Team aus UX/UI-Designern, Entwicklern, Testern, Data Scientisten und weiteren Experten, bringst Du mit agilen Methoden Business Anforderungen und Nutzerperspektive überein und gestaltest so aktiv den Erfolg unseres Marktplatzes.",https://www.stepstone.de/stellenangebote--Senior-Product-Manager-Kundenkonto-all-genders-full-remote-moeglich-Karlsruhe-Home-Office-Chrono24-GmbH--8915961-inline.html,stepstone,2022-11-16,Data_Scientist
DevOps Engineer (m/w/d),vor 1 Woche,Bildungsinnovator,"Home-Office, Düsseldorf, Kleve","Bildungsinnovator * Home-Office, Düsseldorf, Kleve * Feste Anstellung * Home Office möglich,Vollzeit - Cloud Engineer DevOps (m/w/d) Für unsere Standorte Düsseldorf und Kleve oder aus dem Home-Office - DU WILLST BEI DER ENTWICKLUNG DER LERNKARTEN MIT ANPACKEN – ohne Druck durch Deadlines, sondern bedarfsorientiert und gut durchdacht? Gemeinsam mit unserem agilen Entwicklerteam arbeitest Du an der Weiterentwicklung unseres Produktes „LXT“ – einer Lernplattform inkl. CMS für Unternehmen die Lerninhalte bereitstellen. Dabei sind der Einsatz aktueller Technologien und wirksamer Methoden für Dich genauso selbstverständlich wie Spaß bei der Arbeit. Direkte Kommunikation und Zusammenarbeit sind uns wichtig – genauso wie Deine Work-Life-Balance. Aus diesem Grund bieten wir Dir die Flexibilität zu arbeiten, wo du möchtest.",https://www.stepstone.de/stellenangebote--DevOps-Engineer-m-w-d-Home-Office-Duesseldorf-Kleve-Bildungsinnovator--8476990-inline.html,stepstone,2022-11-16,Data_Scientist
Systems & Data Manager (m/w/d) Procurement,08.11.2022,Dr. August Oetker Nahrungsmittel KG,Bielefeld,"Als Systems & Data Manager (m/w/d) Procurement verantwortest du das Management unserer IT-Systeme sowie unsere Lieferanten und Dienstleister im internationalen Einkauf und behältst dabei auch Nachhaltigkeitsthemen im Blick. Du trägst durch Lösungsentwicklungen zur Optimierung im internationalen Einkauf bei und stehst bei Systemproblemen beratend zur Seite. Du unterstützt aktiv die internationale IT-Umsetzung durch den Neuaufbau sowie die Betreuung interner und externer Schnittstellen. Du führst eigenverantwortlich System- und Prozessschulungen für internationale Mitarbeiter*innen durch und betreust die internationalen Lieferanten- und Materialstammdaten im SAP/SRM. Darüber hinaus gehört auch die Leitung und Mitarbeit bei internationalen Projekten im Rahmen der IT-Systeme, Prozesse und Stammdaten zu deinen Aufgaben.",https://www.jobware.de/job/systems-data-manager-m-w-d-procurement.1010205235.html,jobware,2022-11-16,Data_Scientist
IT Inhouse Consultant Business Intelligence / Data Analyst (m/w/d),08.11.2022,Wilhelm Böllhoff GmbH & Co. KG,Bielefeld,"Erstellung von Auswertungen, Analysen, Berichten und Planungen Bedienung und Weiterentwicklung bestehender KPIs Zentraler Ansprechpartner für die Entwicklung unternehmensweiter Standardberichte und Dashboards Analyse der Geschäftsanforderungen der weltweiten internen Kunden Erstellung passgenauer technischer BI-Konzepte und deren Umsetzung mithilfe modernster BI-Technologien Durchführung von Marktbeobachtungen und Verfolgung aktueller Trends im BI- und Advanced-Analytics-Umfeld Enge Zusammenarbeit mit den Fachbereichen, um die Berichtslandschaft weiterzuentwickeln und zu administrieren",https://www.jobware.de/job/it-inhouse-consultant-business-intelligence-data-analyst-m-w-d.1010321955.html,jobware,2022-11-16,Data_Scientist
