job_title,publish,company,city,description,link,website,date,search_title
IT Inhouse Consultant Business Intelligence / Data Analyst (m/w/d),vor 1 Woche,Wilhelm Böllhoff GmbH & Co. KG,Bielefeld,Zur Stärkung unseres Unternehmensbereiches Wilhelm Böllhoff GmbH & Co. KG suchen wir für unseren Hauptsitz in Bielefeld Sie als IT Inhouse Consultant Business Intelligence / (m/w/d),https://www.stepstone.de/stellenangebote--IT-Inhouse-Consultant-Business-Intelligence-Data-Analyst-m-w-d-Bielefeld-Wilhelm-Boellhoff-GmbH-Co-KG--8891819-inline.html,stepstone,2022-12-05,Data_Analyst
Data Analyst / Scientist (m/w/d),vor 3 Wochen,eWolff GmbH,Bielefeld,"Finde Deine Rolle und verstärke unser Team Data Analytics als Data Analyst / Scientist (m/w/d) Data-Driven? * Science, BWL/VWL, MINT oder ähnliches studiert",https://www.stepstone.de/stellenangebote--Data-Analyst-Scientist-m-w-d-Bielefeld-eWolff-GmbH--8228787-inline.html,stepstone,2022-12-05,Data_Analyst
Consultant Data Analyst (m/w/d),vor 1 Woche,Arvato Systems GmbH,Gütersloh,"Und darum suchen wir dich als Consultant Data Analyst (m/w/d) für unseren Standort in Gütersloh mit der Möglichkeit remote zu arbeiten. * Du konzipierst Laderoutinen und Datenmodelle für die zentrale Microsoft SQL-Server -Warehouse Umgebung und entwickelst diese eigenverantwortlich weiter * Idealerweise verfügst du bereits über Berufserfahrung im Umfeld Analytics * Dein Wissen in relationalen Datenbanken (Microsoft SQL-Server) und -Warehouse Konzepten zur Aufbereitung und Historisierung von Daten zeichnen dich aus * Du kannst dich auf umfangreiche und vielfältige Weiterbildungsmöglichkeiten freuen, um deine und Agile Skills weiter auszubauen",https://www.stepstone.de/stellenangebote--Consultant-Data-Analyst-m-w-d-Guetersloh-Arvato-Systems-GmbH--8944409-inline.html,stepstone,2022-12-05,Data_Analyst
Werkstudent/in Sales Data Analyst,vor 1 Woche,DT Swiss Deutschland GmbH,Oelde,"DT Swiss Deutschland GmbH * Oelde * Studentenjobs, Werkstudent * Teilzeit - DT SWISS - SEIT 1994 - Wir gestalten, erfinden, entwickeln und definieren neu, jeden Tag. Wir streben danach, unseren technischen Führungsanspruch täglich zu behaupten. Wir geben immer unser Bestes, um Produkte zu entwickeln, die neue Massstäbe setzen. Wir unterstützen dabei, ihre Ziele zu erreichen. Jeden Tag, seit 1994 dreht sich bei uns alles um ENGINEERING PERFORMANCE. DT Swiss meticulously develops high-performance cycling components that provide a competitive edge to every ambitious cyclist*. *If you have a goal you are ambitious - Ihre Aufgaben * Unterstützung des Vertriebsmanagements bei der datengestützten Entscheidungsfindung im operativen B2B Vertrieb sowie für strategische Vertriebsprojekte * Entwicklung und Umsetzung von Umfragen, Experimenten, Tests sowie weiteren Datenquellen zu",https://www.stepstone.de/stellenangebote--Werkstudent-in-Sales-Data-Analyst-Oelde-DT-Swiss-Deutschland-GmbH--8953634-inline.html,stepstone,2022-12-05,Data_Analyst
Data / Business Analyst (m/w/d),vor 3 Wochen,eWolff GmbH,Bielefeld,"Finde Deine Rolle und verstärke unser Team Data Analytics als Data / Business Analyst (m/w/d) Data-Driven? * BWL/VWL, Science, Wirtschaftsinformatik oder ein verwandtes Fachgebiet studiert",https://www.stepstone.de/stellenangebote--Data-Business-Analyst-m-w-d-Bielefeld-eWolff-GmbH--8227460-inline.html,stepstone,2022-12-05,Data_Analyst
Data Scientist (m/w/d),vor 1 Tag,CONTACT Software GmbH,"Home-Office oder Bremen, Berlin, Paderborn, Duisburg, Köln, Frankfurt, Karlsruhe, Augsburg, München","CONTACT Software GmbH * Home-Office oder Bremen, Berlin, Paderborn, Duisburg, Köln, Frankfurt, Karlsruhe, Augsburg, München * Feste Anstellung * Home Office möglich,Vollzeit - CONTACT Software verbindet Menschen, Unternehmen und Systeme - Als führender Softwarehersteller für innovative Produktentstehungsprozesse und die digitale Transformation haben wir einen modularen Software-Baukasten auf Basis einer offenen Technologieplattform geschaffen, mit dem unsere weltweiten Kunden als internationale Marktführer ihre Produktdaten in agilen Prozessen und kollaborativen Projekten effizienter nutzen. Seit über 30 Jahren entwickeln und implementieren wir smarte Softwarelösungen, die moderne IT-Systeme mit dem Internet der Dinge (IoT) verbinden. Mehr als 350 kreative Köpfe an über zehn Standorten und ein internationales Partnernetzwerk arbeiten täglich daran, unsere Angebote und",https://www.stepstone.de/stellenangebote--Data-Scientist-m-w-d-Home-Office-oder-Bremen-Berlin-Paderborn-Duisburg-Koeln-Frankfurt-Karlsruhe-Augsburg-Muenchen-CONTACT-Software-GmbH--8869313-inline.html,stepstone,2022-12-05,Data_Analyst
Data Scientist (m/w/d),vor 5 Tagen,FERCHAU GmbH,Bielefeld,"Planung, Konzeption, Umsetzung und Wartung von Lösungen in den Bereichen Big Data und Data Science",https://www.stepstone.de/stellenangebote--Data-Scientist-m-w-d-Bielefeld-FERCHAU-GmbH--7838347-inline.html,stepstone,2022-12-05,Data_Analyst
"(Junior) Consultant (w/m/d) IT Prozesse, Big Data und Compliance",vor 2 Wochen,KPMG AG Wirtschaftsprüfungsgesellschaft,"Leipzig, Bielefeld, Dresden, Bremen, Freiburg, Essen, Mainz, Karlsruhe, Dortmund, Regensburg","Als (Junior) Consultant (w/m/d) IT Prozesse, Big Data und Compliance prüfst Du die Systeme unserer Kunden und Kundinnen und bewertest deren IT gestützte Geschäftsprozesse. * Als (Junior) Consultant (w/m/d) für IT Prozesse, Big und Compliance prüfst Du die Einhaltung von Anforderungen im IT-Compliance- und IT Governance-Umfeld und berätst unsere Kund:innen bei der Umsetzung der Regularien. Internet of Things (IoT), Big SAP, Industrie 4.0, IT-Revision, IT Audit oder Robotics sind keine Fremdwörter für Dich.",https://www.stepstone.de/stellenangebote--Junior-Consultant-w-m-d-IT-Prozesse-Big-Data-und-Compliance-Leipzig-Bielefeld-Dresden-Bremen-Freiburg-Essen-Mainz-Karlsruhe-Dortmund-Regensburg-KPMG-AG-Wirtschaftspruefungsgesellschaft--8905503-inline.html,stepstone,2022-12-05,Data_Analyst
Junior Berater*in Prozess- und Datenintegration,vor 3 Wochen,NTT DATA Business Solutions AG,"Berlin, Bielefeld, Dortmund, Göttingen, Hamburg, Heidelberg, Jena, Köln, München ...und weitere","NTT DATA Business Solutions AG - Als Teil der globalen NTT DATA Gruppe, einem der erfolgreichsten IT-Dienstleister der Welt, sind wir als NTT Business Solutions auf wertschöpfende SAP-Lösungen spezialisiert.",https://www.stepstone.de/stellenangebote--Junior-Beraterin-Prozess-und-Datenintegration-Berlin-Bielefeld-Dortmund-Goettingen-Hamburg-Heidelberg-Jena-Koeln-Muenchen-und-weitere-NTT-DATA-Business-Solutions-AG--8090946-inline.html,stepstone,2022-12-05,Data_Analyst
Backend Entwickler (m/w/d),vor 2 Wochen,BFS finance GmbH,Gütersloh,"Wir suchen Kolleg_innen, die Lust haben mitzugestalten und genau hinzuschauen - egal ob Berufseisteigende, IT-Expert_innen, _innen, Sachbearbeiter_innen, Führungskräfte oder Quereinsteigende.",https://www.stepstone.de/stellenangebote--Backend-Entwickler-m-w-d-Guetersloh-BFS-finance-GmbH--8941550-inline.html,stepstone,2022-12-05,Data_Analyst
Junior HR Manager (m/w/d),vor 2 Tagen,BFS finance GmbH,Gütersloh,"Wir suchen Kolleg_innen, die Lust haben mitzugestalten und genau hinzuschauen - egal ob Berufseinsteigende, IT-Expert_innen, _innen, Sachbearbeiter_innen, Führungskräfte oder Quereinsteigende.",https://www.stepstone.de/stellenangebote--Junior-HR-Manager-m-w-d-Guetersloh-BFS-finance-GmbH--8934144-inline.html,stepstone,2022-12-05,Data_Analyst
Teamleiter (m/w/d) Data Services,vor 1 Woche,GOLDBECK GmbH,Bielefeld,"Fachliche Führung sowie Weiterentwicklung eines Data Service Teams * Verantwortung über die Weiterentwicklung der intern übergreifenden Datenstrategie und Governance im Kontext datengetriebener Analytics-Vorhaben im Business Intelligence und Science Umfeld * Mindestens 6 Jahre relevante Berufserfahrung, idealerweise in der Beratung mit den Schwerpunkten Datenstrategie, Governance, Management, Architecture oder Datenqualitätsmanagement",https://www.stepstone.de/stellenangebote--Teamleiter-m-w-d-Data-Services-Bielefeld-GOLDBECK-GmbH--8855839-inline.html,stepstone,2022-12-05,Data_Analyst
Junior Konfigurationsmanager (m/w/d),vor 1 Woche,infoscore Business Support GmbH,"Baden-Baden, Verl","Wir suchen Kolleg_innen, die Lust haben mitzugestalten und genau hinzuschauen - egal ob Berufseinsteigende, IT-Expert_innen, _innen, Sachbearbeiter_innen, Führungskräfte oder Quereinsteigende. Dazu setzen wir auf passgenaue Gesamtpakete, agile Plattformen sowie den gezielten Einsatz von Robots, künstlicher Intelligenz und Big Analytics.",https://www.stepstone.de/stellenangebote--Junior-Konfigurationsmanager-m-w-d-Baden-Baden-Verl-infoscore-Business-Support-GmbH--8702911-inline.html,stepstone,2022-12-05,Data_Analyst
Regulatory Compliance Manager (m/w/d),vor 1 Woche,BFS finance GmbH,"Gütersloh, Home-Office","Wir suchen Kolleg_innen, die Lust haben mitzugestalten und genau hinzuschauen - egal ob Berufseisteigende, IT-Expert_innen, _innen, Sachbearbeiter_innen, Führungskräfte oder Quereinsteigende.",https://www.stepstone.de/stellenangebote--Regulatory-Compliance-Manager-m-w-d-Guetersloh-Home-Office-BFS-finance-GmbH--8957608-inline.html,stepstone,2022-12-05,Data_Analyst
Business Analyst (m/w/d) Production,vor 5 Tagen,GOLDBECK GmbH,Bielefeld,"GOLDBECK GmbH * Bielefeld * Feste Anstellung * Vollzeit - GOLDBECK realisiert zukunftsweisende Immobilien in Europa. Wir verstehen Gebäude als Produkte und bieten alle Leistungen aus einer Hand: vom Design über den Bau bis zu Services im Betrieb. Aktuell beschäftigt unser Familienunternehmen mehr als 10.000 Mitarbeitende an über 100 Standorten bei einer Gesamtleistung von rund 5 Mrd. Euro. Unser Anspruch „building excellence“ steht dabei für Spitzenleistungen beim Planen, Bauen und Betreiben sowie die Weiterentwicklung unserer Talente – Zukunftsfähigkeit inklusive. Eine zukunftsorientierte Informationstechnologie stellt dabei eine wichtige Basis für unseren derzeitigen und künftigen Erfolg dar, weshalb modernste Hardware und Peripheriegeräte, eine aktuelle Entwicklungsumgebung sowie kurze Entscheidungswege für uns selbstverständlich sind. Aufgaben * Analyse von Geschä",https://www.stepstone.de/stellenangebote--Business-Analyst-m-w-d-Production-Bielefeld-GOLDBECK-GmbH--8919163-inline.html,stepstone,2022-12-05,Data_Analyst
Research Manager and Analyst (m/w/d) mit dem Schwerpunkt PLM und Shipbuilding,vor 1 Tag,CONTACT Software GmbH,"Home-Office oder Bremen, Berlin, Paderborn, Duisburg, Köln, Frankfurt, Karlsruhe, Augsburg, München","Abschluss eines technischen Studiums im Fachbereich Maschinenbau, Wirtschaftswissenschaften, (Wirtschafts-) Informatik, Schiffbau oder in einem verwandten Studiengang mit den Schwerpunkten Produktentstehung, Digitalisierung und Product / Lifecycle Management (PDM/PLM)",https://www.stepstone.de/stellenangebote--Research-Manager-and-Analyst-m-w-d-mit-dem-Schwerpunkt-PLM-und-Shipbuilding-Home-Office-oder-Bremen-Berlin-Paderborn-Duisburg-Koeln-Frankfurt-Karlsruhe-Augsburg-Muenchen-CONTACT-Software-GmbH--8870834-inline.html,stepstone,2022-12-05,Data_Analyst
(Senior) Consultant Data Analytics – Public Sector und Energy Consulting (w/m/d),vor 3 Wochen,PwC,"Bielefeld, Düsseldorf, Frankfurt a. M., Hannover, Köln","Dein Studium der Wirtschaftsinformatik oder einer vergleichbaren Disziplin hast du erfolgreich abgeschlossen und bringst erste Berufserfahrung in den Bereichen Reporting, Controlling und Analytics mit.",https://www.stepstone.de/stellenangebote--Senior-Consultant-Data-Analytics-Public-Sector-und-Energy-Consulting-w-m-d-Bielefeld-Duesseldorf-Frankfurt-a-M-Hannover-Koeln-PwC--8488672-inline.html,stepstone,2022-12-05,Data_Analyst
Enterprise Data Architect (m/f/d),vor 4 Tagen,Arvato Infoscore GmbH,"Oslo, Berlin, Baden-Baden, Verl","In this role you will work extensively with data and data analysis in a variety of tools and methods. We expect you to be truly interested in and love to work and wrangle with it. Ultimately, you will enhance our business intelligence solutions to help us make better decisions and become a more driven company. * You design the architecture of our modern platform that enables BI, Science and Machine Learning. * You formulate techniques for quality collection to ensure adequacy, accuracy and legitimacy of * You create, improve and maintain our architectures to create and distribute complex datasets. * You make sure is separated, secured and meeting local as well",https://www.stepstone.de/stellenangebote--Enterprise-Data-Architect-m-f-d-Oslo-Berlin-Baden-Baden-Verl-Arvato-Infoscore-GmbH--8975053-inline.html,stepstone,2022-12-05,Data_Analyst
Sales Consultant - Business Analyst (w/m/d),vor 3 Tagen,DTS Systeme GmbH,"Bensheim, Berlin, Bochum, Bremen, Hamburg, Hannover, Herford, Köln, München, Münster (Westfalen),","DTS Systeme GmbH * Bensheim, Berlin, Bochum, Bremen, Hamburg, Hannover, Herford, Köln, München, Münster (Westfalen), * Feste Anstellung * Vollzeit - Wir unterstützen unsere Kunden als etablierter IT-Dienstleister in den Fokusbereichen Datacenter, Technology und Security. Mit unseren zwei eigenen zertifizierten deutschen Rechenzentren und über 350 Mitarbeiter*innen an 15 Standorten in Deutschland, Österreich und Griechenland bieten wir Kunden vielseitige, innovative sowie hybride Lösungen an. Flache Hierarchien, familiäres Miteinander, nachhaltige Personalentwicklung und eine Kultur der offenen Tür, das ist die DTS. Standort: Bensheim, Berlin, Bochum, Bremen, Hamburg, Hannover, Herford, Köln, München, Münster (Westfalen), Nürnberg - Deine Aufgaben * Du zeigst unseren Kunden aus betriebswirtschaftlicher Sicht neue Möglichkeiten auf und stellst bisherige Konzepte auf den",https://www.stepstone.de/stellenangebote--Sales-Consultant-Business-Analyst-w-m-d-Bensheim-Berlin-Bochum-Bremen-Hamburg-Hannover-Herford-Koeln-Muenchen-Muenster-Westfalen-DTS-Systeme-GmbH--8929151-inline.html,stepstone,2022-12-05,Data_Analyst
Enterprise Data Architect (m/f/d),vor 5 Tagen,Arvato Infoscore GmbH,"Berlin, Verl, Baden-Baden","You design the architecture of our modern data platform that enables BI, Data Science and Machine Learning. * You formulate techniques for quality collection to ensure adequacy, accuracy and legitimacy of * You create, improve and maintain our architectures to create and distribute complex datasets. * You make sure is separated, secured and meeting local as well as international security and privacy standards such as GDPR and other. * You define objects and attributes, definitions, and RASIC matrix for creation, access, change, sources of truth. * You create and enforce policies for effective management. * You ensure digital databases and",https://www.stepstone.de/stellenangebote--Enterprise-Data-Architect-m-f-d-Berlin-Verl-Baden-Baden-Arvato-Infoscore-GmbH--8917739-inline.html,stepstone,2022-12-05,Data_Analyst
Praktikant/Werkstudent Nachhaltigkeit Data Specialist (w/m/d),vor 1 Woche,PwC,"Berlin, Bielefeld, Bremen, Duisburg, Düsseldorf, Erfurt, Essen, Frankfurt a. M., Hamburg, Hannover","PwC * Berlin, Bielefeld, Bremen, Duisburg, Düsseldorf, Erfurt, Essen, Frankfurt a. M., Hamburg, Hannover * Praktikum,Studentenjobs, Werkstudent * Teilzeit,Vollzeit - Du hast Talent. Wir sind ein internationales Netzwerk aus 284.000 Mitarbeiter:innen, die ihr Wissen, ihre Erfahrungen und ihre Ideen miteinander teilen. Du suchst einen herausfordernden, spannenden Job. Wir bieten dir als weltweit führende Wirtschaftsprüfungs- und Beratungsgesellschaft ein Maximum an Möglichkeiten für einen Karriereweg nach deinen Vorstellungen. Du möchtest Verantwortung für deine Ergebnisse übernehmen, Lösungen gemeinsam mit dem Kunden entwickeln, die digitale Transformation in Deutschland vorantreiben und einen Arbeitgeber mit passenden Werten. Unser Denken und Handeln orientiert sich an Grundsätzen, die von Vertrauen, Respekt, Weitsicht, Wertschätzung und Innovation geprägt sind.",https://www.stepstone.de/stellenangebote--Praktikant-Werkstudent-Nachhaltigkeit-Data-Specialist-w-m-d-Berlin-Bielefeld-Bremen-Duisburg-Duesseldorf-Erfurt-Essen-Frankfurt-a-M-Hamburg-Hannover-PwC--8752064-inline.html,stepstone,2022-12-05,Data_Analyst
Strategischer Einkäufer m|w|d Business Unit Professional,vor 1 Woche,Miele & Cie. KG,Bielefeld,"Miele & Cie. * Bielefeld * Feste Anstellung * Vollzeit - Über Miele - Wie wird man als Familienunternehmen Weltmarktführer im Premiumsegment für Hausgeräte und gefragter Partner für Lösungen in der Gewerbe- und Medizintechnik? Indem man den Anspruch hat, es immer besser zu machen und immer besser zu werden. Diese Haltung macht das Arbeiten bei Miele und den Erfolg unserer Produkte aus. Unsere etwa 22.000 Mitarbeitenden können sich darauf verlassen: Wer unser Qualitätsstreben lebt, der wächst persönlich und fachlich daran mit. Über den Bereich - Miele Professional konzentriert sich auf Systemlösungen für Gewerbeanwendungen. Diese innovativen Konzepte umfassen Produkte in den Bereichen gewerbliches Geschirrspülen, Wäschereitechnik, Labortechnik, Dental und Medizintechnik. Für unterschiedliche Anwendungsbereiche steht der Mehrwert für die Zielgruppen im Mittelpunkt der I",https://www.stepstone.de/stellenangebote--Strategischer-Einkaeufer-mwd-Business-Unit-Professional-Bielefeld-Miele-Cie-KG--8889602-inline.html,stepstone,2022-12-05,Data_Analyst
(Senior) Data Engineer (m/f/d),vor 1 Woche,Arvato Infoscore GmbH,"Berlin, Baden-Baden, Verl","Our ambition is higher and now we have a great opportunity for a Data Engineer (m/f/d) to join our growing team. to create and manage BI and analytics solutions that turn data into knowledge using cutting-edge technology. In this role you will work extensively with data and data analysis in a variety of tools and methods. We expect you to be truly interested in data and love to work and wrangle with it. Ultimately, you will enhance our business intelligence solutions to help us make better decisions and become a more data driven company. * Semantic Power BI data modelling and dashboarding for requested initiatives. * Take lead in design and development of ETL solutions using Azure Data Factory, Databricks and other data tools. * Collaborate with international teams to integrate varieties of systems ultimately creating the 'Riverty data universe'.",https://www.stepstone.de/stellenangebote--Senior-Data-Engineer-m-f-d-Berlin-Baden-Baden-Verl-Arvato-Infoscore-GmbH--8891646-inline.html,stepstone,2022-12-05,Data_Analyst
IT Consultant Inhouse (Business Analyst) m/w/d,vor 2 Wochen,Hermes Einrichtungs Service GmbH & Co. KG,Löhne,"Hermes Einrichtungs Service GmbH & Co. KG * Löhne * Feste Anstellung * Home Office möglich,Vollzeit - Als Teil der weltweit operierenden Otto Group sind wir ein erfolgreiches, marktführendes Unternehmen in der B2C-Logistikbranche in Deutschland mit starkem Wachstum. Im Zwei-Mann-Handling setzen wir seit Jahrzehnten Maßstäbe und haben unseren Wettbewerbsvorsprung kontinuierlich ausgebaut. Mit 8.000 Beschäftigten an drei Logistikzentren und rund 60 Depotstandorten sowie leistungsstarken internationalen Netzwerkpartnern beliefern wir jährlich mehr als sieben Millionen Privathaushalte in Deutschland und im benachbarten Ausland. Unsere Mission ist es, stets einwandfreie Logistiklösungen und höchste Qualität sowie ein Plus an Service und Freundlichkeit zu liefern. Damit begeistern wir unsere Kund*innen jeden Tag aufs Neue.",https://www.stepstone.de/stellenangebote--IT-Consultant-Inhouse-Business-Analyst-m-w-d-Loehne-Hermes-Einrichtungs-Service-GmbH-Co-KG--8939621-inline.html,stepstone,2022-12-05,Data_Analyst
IT Infrastruktur Manager (gn) Data Center Services,vor 1 Woche,Westfalen Weser Netz GmbH,Herford,Du stellst zusammen mit unsetern den reibungslosen Betrieb und die kontinuierliche Weiterentwicklung unseres Managed Centers - Cloud und On-premise - sicher,https://www.stepstone.de/stellenangebote--IT-Infrastruktur-Manager-gn-Data-Center-Services-Herford-Westfalen-Weser-Netz-GmbH--8938421-inline.html,stepstone,2022-12-05,Data_Analyst
Senior Consultant (w/m/d) Data Management,vor 2 Wochen,KPMG AG Wirtschaftsprüfungsgesellschaft,"Berlin, Düsseldorf, Frankfurt, Hamburg, München, Köln, Hannover, Münster, Bielefeld, Dortmund",,https://www.stepstone.de/stellenangebote--Senior-Consultant-w-m-d-Data-Management-Berlin-Duesseldorf-Frankfurt-Hamburg-Muenchen-Koeln-Hannover-Muenster-Bielefeld-Dortmund-KPMG-AG-Wirtschaftspruefungsgesellschaft--8931651-inline.html,stepstone,2022-12-05,Data_Analyst
Market Intelligence Manager (m/w/d),vor 1 Woche,BST GmbH,Bielefeld,,https://www.stepstone.de/stellenangebote--Market-Intelligence-Manager-m-w-d-Bielefeld-BST-GmbH--8961502-inline.html,stepstone,2022-12-05,Data_Analyst
Duales Studium Wirtschaftsinformatik (B.Sc.) am Campus oder online,vor 2 Wochen,IU Internationale Hochschule,"Augsburg, Berlin, Bielefeld, Braunschweig, Bremen, Dortmund, Dresden, Düsseldorf, Erfurt, Essen",,https://www.stepstone.de/stellenangebote--Duales-Studium-Wirtschaftsinformatik-B-Sc-am-Campus-oder-online-Augsburg-Berlin-Bielefeld-Braunschweig-Bremen-Dortmund-Dresden-Duesseldorf-Erfurt-Essen-IU-Internationale-Hochschule--8932544-inline.html,stepstone,2022-12-05,Data_Analyst
Junior Supply Chain Analyst (m/w/d) in Teil- oder Vollzeit,vor 23 Stunden,KiK Textilien und Non-Food GmbH,"Bönen, Dortmund, Hamm, Unna, Soest, Oelde, Ascheberg",,https://www.stepstone.de/stellenangebote--Junior-Supply-Chain-Analyst-m-w-d-in-Teil-oder-Vollzeit-Boenen-Dortmund-Hamm-Unna-Soest-Oelde-Ascheberg-KiK-Textilien-und-Non-Food-GmbH--8887923-inline.html,stepstone,2022-12-05,Data_Analyst
1st Level IT-Support (m/w/d),vor 4 Tagen,Merschbrock-Wiese Gewürz GmbH,Rietberg,,https://www.stepstone.de/stellenangebote--1st-Level-IT-Support-m-w-d-Rietberg-Merschbrock-Wiese-Gewuerz-GmbH--8922128-inline.html,stepstone,2022-12-05,Data_Analyst
Financial Business Analyst / Controller (m/w/d),vor 1 Woche,L&S DEUTSCHLAND GmbH,Rödinghausen,,https://www.stepstone.de/stellenangebote--Financial-Business-Analyst-Controller-m-w-d-Roedinghausen-LS-DEUTSCHLAND-GmbH--8908471-inline.html,stepstone,2022-12-05,Data_Analyst
Cyber Security Analyst SIEM (m/w/d),vor 3 Tagen,Hörmann KG Verkaufsgesellschaft,Steinhagen bei Bielefeld,,https://www.stepstone.de/stellenangebote--Cyber-Security-Analyst-SIEM-m-w-d-Steinhagen-bei-Bielefeld-Hoermann-KG-Verkaufsgesellschaft--8971551-inline.html,stepstone,2022-12-05,Data_Analyst
Product Owner / Business Analyst (m/w/d) | Produktdaten,vor 5 Tagen,Arvato Systems Digital GmbH,Rheda-Wiedenbrück,,https://www.stepstone.de/stellenangebote--Product-Owner-Business-Analyst-m-w-d-Produktdaten-Rheda-Wiedenbrueck-Arvato-Systems-Digital-GmbH--8919033-inline.html,stepstone,2022-12-05,Data_Analyst
Product Owner / Business Analyst (m/w/d) I E-Commerce,vor 5 Tagen,Arvato Systems GmbH,Bielefeld,,https://www.stepstone.de/stellenangebote--Product-Owner-Business-Analyst-m-w-d-I-E-Commerce-Bielefeld-Arvato-Systems-GmbH--8919961-inline.html,stepstone,2022-12-05,Data_Analyst
Treasury Analyst & Specialist (m/w/d),vor 5 Tagen,KiK Textilien und Non-Food GmbH,"Bönen, Dortmund, Hamm, Unna, Soest, Oelde, Ascheberg",,https://www.stepstone.de/stellenangebote--Treasury-Analyst-Specialist-m-w-d-Boenen-Dortmund-Hamm-Unna-Soest-Oelde-Ascheberg-KiK-Textilien-und-Non-Food-GmbH--8921485-inline.html,stepstone,2022-12-05,Data_Analyst
Wissenschaftliche*r Mitarbeiter*in im Bereich Data Science und Prescriptive Analytics,vor 3 Tagen,Fachhochschule Bielefeld,Bielefeld,,https://www.stepstone.de/stellenangebote--Wissenschaftlicher-Mitarbeiterin-im-Bereich-Data-Science-und-Prescriptive-Analytics-Bielefeld-Fachhochschule-Bielefeld--8981230-inline.html,stepstone,2022-12-05,Data_Analyst
Java Developer / Product Data (m/w/d) | on-site oder mobile work,vor 5 Tagen,Arvato Systems Digital GmbH,Rheda-Wiedenbrück,,https://www.stepstone.de/stellenangebote--Java-Developer-Product-Data-m-w-d-on-site-oder-mobile-work-Rheda-Wiedenbrueck-Arvato-Systems-Digital-GmbH--8919032-inline.html,stepstone,2022-12-05,Data_Analyst
Kreditanalyst:in im Neu- oder Bestandsgeschäft,vor 1 Woche,Kreissparkasse Wiedenbrück,Rheda-Wiedenbrück,,https://www.stepstone.de/stellenangebote--Kreditanalyst-in-im-Neu-oder-Bestandsgeschaeft-Rheda-Wiedenbrueck-Kreissparkasse-Wiedenbrueck--8940368-inline.html,stepstone,2022-12-05,Data_Analyst
IT Business Analyst (m/w/d),vor 2 Wochen,GOLDBECK GmbH,Bielefeld,,https://www.stepstone.de/stellenangebote--IT-Business-Analyst-m-w-d-Bielefeld-GOLDBECK-GmbH--8839228-inline.html,stepstone,2022-12-05,Data_Analyst
Data Engineer (m/w/d),vor 1 Woche,eWolff GmbH,Bielefeld,,https://www.stepstone.de/stellenangebote--Data-Engineer-m-w-d-Bielefeld-eWolff-GmbH--8442841-inline.html,stepstone,2022-12-05,Data_Analyst
Master Data Manager (m/w/d),vor 1 Woche,OEDIV Oetker Daten- und Informationsverarbeitung KG,"Bielefeld, Oldenburg",,https://www.stepstone.de/stellenangebote--Master-Data-Manager-m-w-d-Bielefeld-Oldenburg-OEDIV-Oetker-Daten-und-Informationsverarbeitung-KG--8957515-inline.html,stepstone,2022-12-05,Data_Analyst
Data Center Infrastructure Engineer (w/m/d),vor 1 Woche,DTS Systeme GmbH,Herford,,https://www.stepstone.de/stellenangebote--Data-Center-Infrastructure-Engineer-w-m-d-Herford-DTS-Systeme-GmbH--8958380-inline.html,stepstone,2022-12-05,Data_Analyst
Data Governance Engineer (m/f/d),vor 1 Woche,Arvato Infoscore GmbH,"Berlin, Baden-Baden, Verl",,https://www.stepstone.de/stellenangebote--Data-Governance-Engineer-m-f-d-Berlin-Baden-Baden-Verl-Arvato-Infoscore-GmbH--8907114-inline.html,stepstone,2022-12-05,Data_Analyst
