job_title,publish,company,city,description,link,website,date,search_title
Cloud Architekt (m/w/d) - Microsoft Azure,vor 3 Tagen,Arvato Systems Digital GmbH,"Gütersloh, Rostock, Schortens, Köln, Leipzig","Als international agierender IT-Spezialist (m/w/d) im Microsoft-Cloud-Umfeld suchen wir deshalb dich als Cloud Architekt (m/w/d) - für einen unserer Standorte in Gütersloh, Rostock, Schortens, Köln oder Leipzig. * Du entwirfst dynamisch skalierbare, hoch verfügbare und sichere Lösungen auf Basis von und bist bei ihrer Umsetzung dabei * Auf 303 folgt für dich 304/305 und praktische Erfahrungen und Zertifizierungen mit sind kein Fremdwort * Du hast einen Blick auf technische Weiterentwicklungen und Trends und stehst dabei im Austausch mit unserem",https://www.stepstone.de/stellenangebote--Cloud-Architekt-m-w-d-Microsoft-Azure-Guetersloh-Rostock-Schortens-Koeln-Leipzig-Arvato-Systems-Digital-GmbH--8881598-inline.html,stepstone,2022-11-21,Microsoft_Azure
"Cloud Solution Architect (Azure, AWS, Google) (m/w/d)",vor 1 Woche,Arvato Systems GmbH,Gütersloh,"Uns alle vereint ein tiefes Verständnis für Cloud-Technologien von Microsoft Azure, AWS oder Google und der Spaß daran, in diesem Umfeld die bestmöglichen Lösungen zu gestalten. Sie ist die Basis für Migration, Transformation und Betrieb großer Enterprise Cloud IT in AWS, Google und Private Cloud. * Du bringst Erfahrungen auf mindestens einem Public Cloud Ökosystem ( Amazon, Google) mit",https://www.stepstone.de/stellenangebote--Cloud-Solution-Architect-Azure-AWS-Google-m-w-d-Guetersloh-Arvato-Systems-GmbH--8867053-inline.html,stepstone,2022-11-21,Microsoft_Azure
Backend Developer (m/w/d) – Azure & .NET,vor 3 Wochen,GOLDBECK GmbH,"Bielefeld, Leipzig, Plauen","Erste Erfahrung im Cloud-Bereich, idealerweise in Microsoft Azure Backend Developer (m/w/d) – Azure & .NET * Entwicklung und Integration von eigenen Komponenten auf Basis der Cloud (Functions, Logic Apps, Web Apps, Service Bus, Event Grid, Event Hubs, …) * Praktische Erfahrungen in Continuous Integration und Deployment (z. B. Git, DevOps)",https://www.stepstone.de/stellenangebote--Backend-Developer-m-w-d-Azure-NET-Bielefeld-Leipzig-Plauen-GOLDBECK-GmbH--8767494-inline.html,stepstone,2022-11-21,Microsoft_Azure
Softwareentwickler (m/w/d) interne Infrastruktur,vor 8 Stunden,dSPACE GmbH,Paderborn,"Entwicklung sowie Pflege von Tools und Erweiterungen für Anwendungssysteme, wie Microsoft Azure DevOps sowie selbstentwickelte Werkzeuge - o DevOps * Aufbau sowie Pflege von Intranet-Seiten und -strukturen ( Sharepoint-Technologie)",https://www.stepstone.de/stellenangebote--Softwareentwickler-m-w-d-interne-Infrastruktur-Paderborn-dSPACE-GmbH--8333340-inline.html,stepstone,2022-11-21,Microsoft_Azure
(Senior) Associate Data Validation Teilzeit/Vollzeit (w/m/d),vor 1 Tag,PwC,"Berlin, Bielefeld, Bremen, Duisburg, Düsseldorf, Erfurt, Essen, Frankfurt a. M., Hamburg, Hannover,","Datenanalysen - Du führst auf Basis von modernen Tools und Lösungen wie Alteryx, Microsoft Azure oder Power BI Datenanalysen durch und schaffst somit einen Mehrwert für unsere Mandanten.",https://www.stepstone.de/stellenangebote--Senior-Associate-Data-Validation-Teilzeit-Vollzeit-w-m-d-Berlin-Bielefeld-Bremen-Duisburg-Duesseldorf-Erfurt-Essen-Frankfurt-a-M-Hamburg-Hannover-PwC--8842414-inline.html,stepstone,2022-11-21,Microsoft_Azure
Enterprise Data Architect (m/f/d),vor 1 Woche,Arvato Infoscore GmbH,"Berlin, Verl, Baden-Baden","You are always up to date with the latest developments in data technologies and architectures, especially in You already have experience with Purview for Data Governance.",https://www.stepstone.de/stellenangebote--Enterprise-Data-Architect-m-f-d-Berlin-Verl-Baden-Baden-Arvato-Infoscore-GmbH--8917739-inline.html,stepstone,2022-11-21,Microsoft_Azure
(Senior) Softwarearchitekt (m/w/d),vor 3 Tagen,Arvato Systems Digital GmbH,Gütersloh,"Du bringst gute Kenntnisse von Cloud-Services (vorzugsweise Microsoft Azure) mit und konntest bereits Erfahrung in der Umsetzung von Cloud Architekturen sammeln - Uns alle vereint ein tiefes Verständnis für .NET / Web und Cloud-Technologien von und der Spaß daran, in diesem Umfeld die bestmöglichen Lösungen zu gestalten.",https://www.stepstone.de/stellenangebote--Senior-Softwarearchitekt-m-w-d-Guetersloh-Arvato-Systems-Digital-GmbH--8829003-inline.html,stepstone,2022-11-21,Microsoft_Azure
(Senior) Full-Stack Developer Fintech Innovation (m/f/d),vor 3 Tagen,Arvato Infoscore GmbH,"Verl, Berlin, Baden-Baden","Databases and cloud technologies and services, ideally Microsoft Azure",https://www.stepstone.de/stellenangebote--Senior-Full-Stack-Developer-Fintech-Innovation-m-f-d-Verl-Berlin-Baden-Baden-Arvato-Infoscore-GmbH--8882267-inline.html,stepstone,2022-11-21,Microsoft_Azure
(Senior) Systemadministrator (m/w/x),vor 8 Stunden,Arvato Supply Chain Solutions SE – Consumer Products,"Hannover, Gütersloh, Köln, Hamburg, Münster",Du unterstützt die internationale Administration unserer on premise Server-Systeme und unsere Journey der Systeme in die Cloud,https://www.stepstone.de/stellenangebote--Senior-Systemadministrator-m-w-x-Hannover-Guetersloh-Koeln-Hamburg-Muenster-Arvato-Supply-Chain-Solutions-SE-Consumer-Products--8939900-inline.html,stepstone,2022-11-21,Microsoft_Azure
Enterprise Data Architect (m/f/d),vor 6 Tagen,Arvato Infoscore GmbH,"Oslo, Berlin, Baden-Baden, Verl","You are always up to date with the latest developments in data technologies and architectures, especially in You already have experience with Purview for Data Governance. * Experience with streaming data Service Bus/Event Hub.",https://www.stepstone.de/stellenangebote--Enterprise-Data-Architect-m-f-d-Oslo-Berlin-Baden-Baden-Verl-Arvato-Infoscore-GmbH--8871550-inline.html,stepstone,2022-11-21,Microsoft_Azure
Microsoft Developer (m/w/d),vor 3 Tagen,Arvato Systems GmbH,Bielefeld,Als international agierender IT-Spezialist suchen wir deshalb dich als Microsoft Developer (m/w/d) * Du verfügst über eine große Berufserfahrung in Microsoft.NET ( C# etc.) * Auch mit den gängigen Office Produkten kennst du dich bestens aus,https://www.stepstone.de/stellenangebote--Microsoft-Developer-m-w-d-Bielefeld-Arvato-Systems-GmbH--8829002-inline.html,stepstone,2022-11-21,Microsoft_Azure
Softwareentwickler als Berufseinsteiger (m/w/d) Simulationsplattform VEOS,vor 1 Woche,dSPACE GmbH,Paderborn,"Anwendung aktueller Technologien und Entwicklungsumgebungen, u. a. Git, Microsoft® Azure® DevOps, Visual Studio®, C#, C++",https://www.stepstone.de/stellenangebote--Softwareentwickler-als-Berufseinsteiger-m-w-d-Simulationsplattform-VEOS-Paderborn-dSPACE-GmbH--8803741-inline.html,stepstone,2022-11-21,Microsoft_Azure
IT-Administrator (m/w/d) Cloud-Infrastruktur,vor 1 Woche,GOLDBECK GmbH,"Bielefeld, Leipzig, Plauen","Praktische Erfahrung im Microsoft Azure Umfeld (z.B. Windows, Datenbanken, Monitoring, Security) * Erfahrungen in der Verwaltung und Administration von AD und AD",https://www.stepstone.de/stellenangebote--IT-Administrator-m-w-d-Cloud-Infrastruktur-Bielefeld-Leipzig-Plauen-GOLDBECK-GmbH--8812648-inline.html,stepstone,2022-11-21,Microsoft_Azure
Cloud Developer Java (m/w/d),vor 2 Tagen,direct services Gütersloh GmbH BPG-IT,"Gütersloh, Home Office",Du kennst Dich in der AWS und der Azure Cloud aus.,https://www.stepstone.de/stellenangebote--Cloud-Developer-Java-m-w-d-Guetersloh-Home-Office-direct-services-Guetersloh-GmbH-BPG-IT--8886944-inline.html,stepstone,2022-11-21,Microsoft_Azure
IT-Systemadministrator (m/w/d),vor 4 Tagen,avitea GmbH,Soest,"Fundierte Kenntnisse der Cloud-Dienste (z. B. Microsoft Azure, Office 365) * Sicherer Umgang mit Microsoft- und Unix-Betriebssystemen",https://www.stepstone.de/stellenangebote--IT-Systemadministrator-m-w-d-Soest-avitea-GmbH--7815338-inline.html,stepstone,2022-11-21,Microsoft_Azure
Cloud Architecture Consultant (m/w/d),vor 1 Woche,OEDIV Oetker Daten- und Informationsverarbeitung KG,"Bielefeld, Rostock, Augsburg, Oldenburg, Berlin, Frankfurt am Main, Köln","Du bringst gute Kenntnisse in Cloud Umgebungen, primär Microsoft Azure und/oder Google mit - Der Schwerpunkt liegt dabei vor allem auf und SAP Technologien. * Mehrjährige Berufserfahrung oder qualifizierte Weiterbildungsmaßnahmen, sowie eine Zertifizierung im Bereich und/oder Google Cloud runden Dein Profil zusätzlich ab",https://www.stepstone.de/stellenangebote--Cloud-Architecture-Consultant-m-w-d-Bielefeld-Rostock-Augsburg-Oldenburg-Berlin-Frankfurt-am-Main-Koeln-OEDIV-Oetker-Daten-und-Informationsverarbeitung-KG--8917184-inline.html,stepstone,2022-11-21,Microsoft_Azure
IT Systems Administrator (m/w/d),vor 1 Woche,DTS Systeme GmbH,"Bensheim, Berlin, Bochum, Bremen, Hamburg, Hannover, Herford, Köln, München, Münster (Westfalen),","Gute Kenntnisse in Microsoft Azure, Office 365, Active Directory Server, Exchange Infrastrukturen private Cloud und Exchange Online * IT-Spezialist (m/w/d) für die Themen und Office 365 für uns und unsere Kunden",https://www.stepstone.de/stellenangebote--IT-Systems-Administrator-m-w-d-Bensheim-Berlin-Bochum-Bremen-Hamburg-Hannover-Herford-Koeln-Muenchen-Muenster-Westfalen-DTS-Systeme-GmbH--8868959-inline.html,stepstone,2022-11-21,Microsoft_Azure
Software Developer (m/w/d) Agile Produktentwicklung mit C#/.NET,vor 1 Woche,dSPACE GmbH,Paderborn,"Erfahrungen mit Microsoft® Azure® DevOps, Git und Microsoft Visual Studio® wünschenswert",https://www.stepstone.de/stellenangebote--Software-Developer-m-w-d-Agile-Produktentwicklung-mit-C-NET-Paderborn-dSPACE-GmbH--8532759-inline.html,stepstone,2022-11-21,Microsoft_Azure
PowerPlatform Engineer (m/w/d),vor 1 Woche,GOLDBECK GmbH,Bielefeld,"Praktische Erfahrungen in der Anwendung der Microsoft PowerPlatform (Power Apps, Power Automate, DataVerse, Power BI, Power Virtual Agents, AI Builder) und in * Konzeption, Realisierung und Implementierung von individuellen Lösungen auf Basis der PowerPlatform * Arbeiten mit innovativen Technologien, z.B. Power Apps, Power Automate, Power Virtual Agents, RPA, Al/ML, Logic Apps",https://www.stepstone.de/stellenangebote--PowerPlatform-Engineer-m-w-d-Bielefeld-GOLDBECK-GmbH--8844134-inline.html,stepstone,2022-11-21,Microsoft_Azure
Systems Engineer - Microsoft 365 Security (m/w/d),vor 1 Woche,OEDIV Oetker Daten- und Informationsverarbeitung KG,"Bielefeld, Rostock, Augsburg, Oldenburg, Berlin, Frankfurt am Main, Köln","Dein Aufgabenbereich umfasst die Beratung, das Design, die Implementierung und den Support von Microsoft Security Diensten mit den Schwerpunkten 365 Defender und Sentinel in Hybriden Cloud Szenarien * Du bringst Erfahrung in Umgebungen, insbesondere Active Directory, Windows Server und 365 Defender und Sentines mit - Der Schwerpunkt liegt dabei vor allem auf und SAP Technologien. * Mit Conditional Access, AD Identity Protection und Windows Hello for Business sicherst du Identitäten ab",https://www.stepstone.de/stellenangebote--Systems-Engineer-Microsoft-365-Security-m-w-d-Bielefeld-Rostock-Augsburg-Oldenburg-Berlin-Frankfurt-am-Main-Koeln-OEDIV-Oetker-Daten-und-Informationsverarbeitung-KG--8917569-inline.html,stepstone,2022-11-21,Microsoft_Azure
Cloud / Software Architekt (m/w/d) für Smart Building,vor 1 Tag,GOLDBECK GmbH,"Bielefeld, Köln","Mehrjährige Erfahrung zu Cloud-Plattformen wie Azure, AWS und Google (GCP), sowie zu MQTT aus komplexen Projekten",https://www.stepstone.de/stellenangebote--Cloud-Software-Architekt-m-w-d-fuer-Smart-Building-Bielefeld-Koeln-GOLDBECK-GmbH--8124742-inline.html,stepstone,2022-11-21,Microsoft_Azure
Technical Customer Consultant (m/w/d),vor 1 Woche,OEDIV Oetker Daten- und Informationsverarbeitung KG,"Bielefeld, Rostock, Augsburg, Oldenburg, Berlin, Frankfurt am Main","Du verfügst über gute Kenntnisse in Cloud (primär Microsoft Azure) Der Schwerpunkt liegt dabei vor allem auf und SAP Technologien. * Du bringst fundierte Fachkenntnisse im Umfeld von oder SAP-Technologien sowie im Bereich IT-Infrastrukturtechnologien (Netzwerk, Server und Betriebssysteme), Security und Prozessen nach ITIL mit",https://www.stepstone.de/stellenangebote--Technical-Customer-Consultant-m-w-d-Bielefeld-Rostock-Augsburg-Oldenburg-Berlin-Frankfurt-am-Main-OEDIV-Oetker-Daten-und-Informationsverarbeitung-KG--8798818-inline.html,stepstone,2022-11-21,Microsoft_Azure
Senior / Professional Backend Developer (m/w/d) für Smart Building,vor 1 Tag,GOLDBECK GmbH,"Bielefeld, Köln","Erfahrung zu Cloud-Plattformen wie Azure, AWS und GCP",https://www.stepstone.de/stellenangebote--Senior-Professional-Backend-Developer-m-w-d-fuer-Smart-Building-Bielefeld-Koeln-GOLDBECK-GmbH--8125267-inline.html,stepstone,2022-11-21,Microsoft_Azure
SAP BTP Senior Consultant (m/w/d),vor 1 Woche,OEDIV Oetker Daten- und Informationsverarbeitung KG,"Bielefeld, Rostock, Augsburg, Oldenburg, Berlin, Frankfurt am Main","Du bringst gute Kenntnisse in Cloud, primär in Microsoft Azure und gute Kenntnisse in der Business Technology Platform mit - Der Schwerpunkt liegt dabei vor allem auf und SAP Technologien.",https://www.stepstone.de/stellenangebote--SAP-BTP-Senior-Consultant-m-w-d-Bielefeld-Rostock-Augsburg-Oldenburg-Berlin-Frankfurt-am-Main-OEDIV-Oetker-Daten-und-Informationsverarbeitung-KG--8798719-inline.html,stepstone,2022-11-21,Microsoft_Azure
Applikationsmanager (gn) Datawarehouse und BI,vor 2 Tagen,Westfalen Weser Netz GmbH,"Herford, Paderborn","Wünschenswert sind Erfahrungen mit z.B. Power BI, SAP BW, Jedox, Low Code Datenintegration/ETL/ESB (z.B. mit MS oder X4)",https://www.stepstone.de/stellenangebote--Applikationsmanager-gn-Datawarehouse-und-BI-Herford-Paderborn-Westfalen-Weser-Netz-GmbH--8578664-inline.html,stepstone,2022-11-21,Microsoft_Azure
Windows Server Administrator (m/w/d),vor 1 Woche,Arvato Systems GmbH,Gütersloh,,https://www.stepstone.de/stellenangebote--Windows-Server-Administrator-m-w-d-Guetersloh-Arvato-Systems-GmbH--8916908-inline.html,stepstone,2022-11-21,Microsoft_Azure
Systemadministrator (m/w/d) im Bereich Client Security,vor 2 Tagen,Arvato Systems GmbH,Rheda-Wiedenbrück,,https://www.stepstone.de/stellenangebote--Systemadministrator-m-w-d-im-Bereich-Client-Security-Rheda-Wiedenbrueck-Arvato-Systems-GmbH--8888956-inline.html,stepstone,2022-11-21,Microsoft_Azure
Smart Factory Key-User Data *,vor 1 Woche,Weidmüller Gruppe,Detmold,,https://www.stepstone.de/stellenangebote--Smart-Factory-Key-User-Data-Detmold-Weidmueller-Gruppe--8392500-inline.html,stepstone,2022-11-21,Microsoft_Azure
Technical IT Consultant - Modern Workplace (m/w/d),vor 1 Woche,OEDIV Oetker Daten- und Informationsverarbeitung KG,"Bielefeld, Rostock, Augsburg, Oldenburg, Berlin, Frankfurt am Main, Köln",,https://www.stepstone.de/stellenangebote--Technical-IT-Consultant-Modern-Workplace-m-w-d-Bielefeld-Rostock-Augsburg-Oldenburg-Berlin-Frankfurt-am-Main-Koeln-OEDIV-Oetker-Daten-und-Informationsverarbeitung-KG--8917275-inline.html,stepstone,2022-11-21,Microsoft_Azure
Windows Server Professional / Consultant (m/w/d),vor 1 Woche,Arvato Systems GmbH,Gütersloh,,https://www.stepstone.de/stellenangebote--Windows-Server-Professional-Consultant-m-w-d-Guetersloh-Arvato-Systems-GmbH--8916904-inline.html,stepstone,2022-11-21,Microsoft_Azure
Fachinformatiker (m/w/d),vor 3 Tagen,BeKom Datensysteme GmbH & Co. KG,Bad Salzuflen,,https://www.stepstone.de/stellenangebote--Fachinformatiker-m-w-d-Bad-Salzuflen-BeKom-Datensysteme-GmbH-Co-KG--8884221-inline.html,stepstone,2022-11-21,Microsoft_Azure
MS Dynamics 365 F&O Developer (m/w/d),vor 2 Wochen,Takko Fashion GmbH,Telgte,,https://www.stepstone.de/stellenangebote--MS-Dynamics-365-FO-Developer-m-w-d-Telgte-Takko-Fashion-GmbH--8894879-inline.html,stepstone,2022-11-21,Microsoft_Azure
Systemingenieur (m/w/d) Microsoft Windows Server,vor 1 Woche,Arvato Systems GmbH,Gütersloh,,https://www.stepstone.de/stellenangebote--Systemingenieur-m-w-d-Microsoft-Windows-Server-Guetersloh-Arvato-Systems-GmbH--8916912-inline.html,stepstone,2022-11-21,Microsoft_Azure
Cloud Engineer (m/w/d) im Bereich Validierung autonomer Fahrzeuge,vor 3 Wochen,dSPACE GmbH,"Paderborn, Böblingen (bei Stuttgart), Pfaffenhofen a. d. Ilm (bei München), Wolfsburg, Karlsruhe",,https://www.stepstone.de/stellenangebote--Cloud-Engineer-m-w-d-im-Bereich-Validierung-autonomer-Fahrzeuge-Paderborn-Boeblingen-bei-Stuttgart-Pfaffenhofen-a-d-Ilm-bei-Muenchen-Wolfsburg-Karlsruhe-dSPACE-GmbH--8758587-inline.html,stepstone,2022-11-21,Microsoft_Azure
(Junior) Software Developer – Inhouse (m/w/d),vor 3 Tagen,Energieversum GmbH & Co. KG,Gütersloh,,https://www.stepstone.de/stellenangebote--Junior-Software-Developer-Inhouse-m-w-d-Guetersloh-Energieversum-GmbH-Co-KG--8884800-inline.html,stepstone,2022-11-21,Microsoft_Azure
IT Governance Manager (m/f/d),vor 3 Tagen,Riverty GmbH,"Verl, Berlin",,https://www.stepstone.de/stellenangebote--IT-Governance-Manager-m-f-d-Verl-Berlin-Riverty-GmbH--8934748-inline.html,stepstone,2022-11-21,Microsoft_Azure
Frontend Entwickler Angular / React (m/w/d),vor 3 Tagen,Riverty Services GmbH,"Baden-Baden, Verl, Berlin",,https://www.stepstone.de/stellenangebote--Frontend-Entwickler-Angular-React-m-w-d-Baden-Baden-Verl-Berlin-Riverty-Services-GmbH--8673925-inline.html,stepstone,2022-11-21,Microsoft_Azure
IT-Systemadministrator (w/m/d) im First- und Second-Level-Bereich,vor 1 Woche,Energieversum GmbH & Co. KG,Gütersloh,,https://www.stepstone.de/stellenangebote--IT-Systemadministrator-w-m-d-im-First-und-Second-Level-Bereich-Guetersloh-Energieversum-GmbH-Co-KG--8866679-inline.html,stepstone,2022-11-21,Microsoft_Azure
IT Mitarbeiter (m/w/d) Systemadministration und Support,vor 4 Tagen,WEMAS Absperrtechnik GmbH,Gütersloh,,https://www.stepstone.de/stellenangebote--IT-Mitarbeiter-m-w-d-Systemadministration-und-Support-Guetersloh-WEMAS-Absperrtechnik-GmbH--8768812-inline.html,stepstone,2022-11-21,Microsoft_Azure
Data Governance Engineer (m/f/d),vor 1 Woche,Arvato Infoscore GmbH,"Berlin, Baden-Baden, Verl",,https://www.stepstone.de/stellenangebote--Data-Governance-Engineer-m-f-d-Berlin-Baden-Baden-Verl-Arvato-Infoscore-GmbH--8907114-inline.html,stepstone,2022-11-21,Microsoft_Azure
Java Developer im (Multi-) Cloud Umfeld (w/m/d),vor 1 Woche,NTT DATA Business Solutions AG,"Berlin, Bielefeld, Bautzen, Dresden, Hamburg, Heidelberg, Köln, München, Pforzheim, Stuttgart",,https://www.stepstone.de/stellenangebote--Java-Developer-im-Multi-Cloud-Umfeld-w-m-d-Berlin-Bielefeld-Bautzen-Dresden-Hamburg-Heidelberg-Koeln-Muenchen-Pforzheim-Stuttgart-NTT-DATA-Business-Solutions-AG--8093333-inline.html,stepstone,2022-11-21,Microsoft_Azure
Project Manager (m/w/d) Engineering,vor 4 Tagen,dSPACE GmbH,Paderborn,,https://www.stepstone.de/stellenangebote--Project-Manager-m-w-d-Engineering-Paderborn-dSPACE-GmbH--8919490-inline.html,stepstone,2022-11-21,Microsoft_Azure
IT-Security Specialist (m/w/d) Security Operator,vor 5 Tagen,GOLDBECK GmbH,Bielefeld,,https://www.stepstone.de/stellenangebote--IT-Security-Specialist-m-w-d-Security-Operator-Bielefeld-GOLDBECK-GmbH--8824002-inline.html,stepstone,2022-11-21,Microsoft_Azure
Service Owner (m/w/d) M365,vor 1 Woche,Nagel-Group Logistics SE,Versmold,,https://www.stepstone.de/stellenangebote--Service-Owner-m-w-d-M365-Versmold-Nagel-Group-Logistics-SE--8909486-inline.html,stepstone,2022-11-21,Microsoft_Azure
IT-Security Specialist (m/w/d) Incident Handling & Cloud Security,vor 5 Tagen,GOLDBECK GmbH,Bielefeld,,https://www.stepstone.de/stellenangebote--IT-Security-Specialist-m-w-d-Incident-Handling-Cloud-Security-Bielefeld-GOLDBECK-GmbH--8823663-inline.html,stepstone,2022-11-21,Microsoft_Azure
Java/TypeScript Entwickler (m/w/d) - Java Developer - 100 % Remote möglich,vor 1 Tag,Ratbacher GmbH,"Home-Office, Dortmund, Bielefeld, Mainz, Reutlingen",,https://www.stepstone.de/stellenangebote--Java-TypeScript-Entwickler-m-w-d-Java-Developer-100-Remote-moeglich-Home-Office-Dortmund-Bielefeld-Mainz-Reutlingen-Ratbacher-GmbH--8327819-inline.html,stepstone,2022-11-21,Microsoft_Azure
Java Developer / Product Data (m/w/d) | on-site oder mobile work,vor 6 Tagen,Arvato Systems Digital GmbH,Rheda-Wiedenbrück,,https://www.stepstone.de/stellenangebote--Java-Developer-Product-Data-m-w-d-on-site-oder-mobile-work-Rheda-Wiedenbrueck-Arvato-Systems-Digital-GmbH--8919032-inline.html,stepstone,2022-11-21,Microsoft_Azure
IT Infrastruktur Administrator Windows (m/w/d),vor 6 Tagen,Riverty Services GmbH,"Verl, Baden-Baden",,https://www.stepstone.de/stellenangebote--IT-Infrastruktur-Administrator-Windows-m-w-d-Verl-Baden-Baden-Riverty-Services-GmbH--8870952-inline.html,stepstone,2022-11-21,Microsoft_Azure
Frontend Developer * Software für das Konfigurationstool WMC,vor 6 Tagen,Weidmüller Gruppe,Lemgo,,https://www.stepstone.de/stellenangebote--Frontend-Developer-Software-fuer-das-Konfigurationstool-WMC-Lemgo-Weidmueller-Gruppe--8400124-inline.html,stepstone,2022-11-21,Microsoft_Azure
IT-Architekt als (Junior) Consultant / Berater (w/m/d) IT Strategie / Cloud Solutions,vor 1 Woche,KPMG AG Wirtschaftsprüfungsgesellschaft,"Hannover, Nürnberg, Mannheim, Bielefeld, Dresden, Bremen, Freiburg, Essen, Mainz, Karlsruhe, Ulm",,https://www.stepstone.de/stellenangebote--IT-Architekt-als-Junior-Consultant-Berater-w-m-d-IT-Strategie-Cloud-Solutions-Hannover-Nuernberg-Mannheim-Bielefeld-Dresden-Bremen-Freiburg-Essen-Mainz-Karlsruhe-Ulm-KPMG-AG-Wirtschaftspruefungsgesellschaft--8905435-inline.html,stepstone,2022-11-21,Microsoft_Azure
Ausbilder * Informatik,vor 2 Wochen,Weidmüller Gruppe,Paderborn,,https://www.stepstone.de/stellenangebote--Ausbilder-Informatik-Paderborn-Weidmueller-Gruppe--8893299-inline.html,stepstone,2022-11-21,Microsoft_Azure
SAP Basis Administrator (m/w/d),vor 1 Woche,Arvato Systems GmbH,"Gütersloh, Hamburg, Leipzig oder Dortmund",,https://www.stepstone.de/stellenangebote--SAP-Basis-Administrator-m-w-d-Guetersloh-Hamburg-Leipzig-oder-Dortmund-Arvato-Systems-GmbH--8867151-inline.html,stepstone,2022-11-21,Microsoft_Azure
Systemadministrator / IT System Engineer (m/w/d) Windows,vor 1 Woche,Amadeus FiRe AG,"Aachen, Berlin, Bielefeld, Bremen, Dortmund, Düsseldorf, Essen, Hamburg, Hannover, Köln, Münster",,https://www.stepstone.de/stellenangebote--Systemadministrator-IT-System-Engineer-m-w-d-Windows-Aachen-Berlin-Bielefeld-Bremen-Dortmund-Duesseldorf-Essen-Hamburg-Hannover-Koeln-Muenster-Amadeus-FiRe-AG--8805903-inline.html,stepstone,2022-11-21,Microsoft_Azure
Projektmanager - Microsoft Services (m/w/d),vor 1 Woche,OEDIV Oetker Daten- und Informationsverarbeitung KG,Bielefeld,,https://www.stepstone.de/stellenangebote--Projektmanager-Microsoft-Services-m-w-d-Bielefeld-OEDIV-Oetker-Daten-und-Informationsverarbeitung-KG--8911430-inline.html,stepstone,2022-11-21,Microsoft_Azure
IT Admin (m/w/d),vor 1 Woche,Triple A Internetshops GmbH,Bielefeld,,https://www.stepstone.de/stellenangebote--IT-Admin-m-w-d-Bielefeld-Triple-A-Internetshops-GmbH--8906326-inline.html,stepstone,2022-11-21,Microsoft_Azure
Full Stack Developer für Webservice Plattform (w/m/d),vor 1 Woche,Techem Energy Services GmbH,"Bielefeld, Eschborn, Home-Office",,https://www.stepstone.de/stellenangebote--Full-Stack-Developer-fuer-Webservice-Plattform-w-m-d-Bielefeld-Eschborn-Home-Office-Techem-Energy-Services-GmbH--8853422-inline.html,stepstone,2022-11-21,Microsoft_Azure
Ingenieur modellbasierte Entwicklung/Embedded Programmierung (w/m/d),vor 1 Woche,dSPACE GmbH,"Paderborn, Böblingen (bei Stuttgart)",,https://www.stepstone.de/stellenangebote--Ingenieur-modellbasierte-Entwicklung-Embedded-Programmierung-w-m-d-Paderborn-Boeblingen-bei-Stuttgart-dSPACE-GmbH--7327500-inline.html,stepstone,2022-11-21,Microsoft_Azure
Cloud Data Engineer (m/w/d),vor 1 Woche,GOLDBECK GmbH,Bielefeld,,https://www.stepstone.de/stellenangebote--Cloud-Data-Engineer-m-w-d-Bielefeld-GOLDBECK-GmbH--8795650-inline.html,stepstone,2022-11-21,Microsoft_Azure
(Senior) Sales Manager - Multi Cloud Services (m/w/d),vor 1 Woche,Arvato Systems Digital GmbH,"Gütersloh, Hamburg, Köln, Leipzig oder remote",,https://www.stepstone.de/stellenangebote--Senior-Sales-Manager-Multi-Cloud-Services-m-w-d-Guetersloh-Hamburg-Koeln-Leipzig-oder-remote-Arvato-Systems-Digital-GmbH--8897363-inline.html,stepstone,2022-11-21,Microsoft_Azure
Software Engineer (m/w/d) Warehouse Control System (WCS),vor 1 Woche,Dürkopp Fördertechnik GmbH,Bielefeld,,https://www.stepstone.de/stellenangebote--Software-Engineer-m-w-d-Warehouse-Control-System-WCS-Bielefeld-Duerkopp-Foerdertechnik-GmbH--8896812-inline.html,stepstone,2022-11-21,Microsoft_Azure
(Senior) Cloud Engineer (all genders) für die adesso as a service,vor 1 Woche,adesso as a service GmbH,"Dortmund, Frankfurt/Main, Berlin, Karlsruhe, Düsseldorf, Paderborn",,https://www.stepstone.de/stellenangebote--Senior-Cloud-Engineer-all-genders-fuer-die-adesso-as-a-service-Dortmund-Frankfurt-Main-Berlin-Karlsruhe-Duesseldorf-Paderborn-adesso-as-a-service-GmbH--8898201-inline.html,stepstone,2022-11-21,Microsoft_Azure
Technische Projektleitung (all genders) für die adesso as a service,vor 1 Woche,adesso as a service GmbH,"Dortmund, Frankfurt/Main, Berlin, München, Karlsruhe, Düsseldorf, Paderborn",,https://www.stepstone.de/stellenangebote--Technische-Projektleitung-all-genders-fuer-die-adesso-as-a-service-Dortmund-Frankfurt-Main-Berlin-Muenchen-Karlsruhe-Duesseldorf-Paderborn-adesso-as-a-service-GmbH--8897185-inline.html,stepstone,2022-11-21,Microsoft_Azure
Application Support Service (m/w/d),vor 1 Woche,Arvato Systems Digital GmbH,"Gütersloh, Hamburg, Köln, Leipzig oder Rostock",,https://www.stepstone.de/stellenangebote--Application-Support-Service-m-w-d-Guetersloh-Hamburg-Koeln-Leipzig-oder-Rostock-Arvato-Systems-Digital-GmbH--8897431-inline.html,stepstone,2022-11-21,Microsoft_Azure
IT Specialist - Access Management (m/w/d),vor 2 Wochen,CLAAS KGaA mbH,Harsewinkel,,https://www.stepstone.de/stellenangebote--IT-Specialist-Access-Management-m-w-d-Harsewinkel-CLAAS-KGaA-mbH--8891817-inline.html,stepstone,2022-11-21,Microsoft_Azure
